{
  "$schema": "https://json-schema.org/draft/2020-12/schema",
  "$id": "https://shangyu.local/schemas/company-registry-v1.json",
  "title": "Shangyu Company Registry",
  "type": "object",
  "required": ["schema_version", "registry_id", "status", "companies"],
  "properties": {
    "schema_version": {"const": "1.0"},
    "registry_id": {"type": "string", "minLength": 1},
    "status": {"enum": ["active", "draft", "retired"]},
    "design_note": {"type": "string"},
    "companies": {
      "type": "array",
      "items": {
        "type": "object",
        "required": [
          "company_id",
          "display_name",
          "status",
          "enabled",
          "source_profiles",
          "workflows",
          "capabilities",
          "source_refs",
          "last_verified_on"
        ],
        "properties": {
          "company_id": {"type": "string", "pattern": "^[a-z0-9_]+$"},
          "display_name": {"type": "string", "minLength": 1},
          "legal_name": {"type": "string", "minLength": 1},
          "abbreviation": {"type": "string", "pattern": "^[A-Za-z0-9_-]{1,16}$"},
          "aliases": {"type": "array", "items": {"type": "string", "minLength": 1}, "uniqueItems": true},
          "status": {"enum": ["active", "fallback_enabled", "identity_only", "paused", "retired", "pending"]},
          "enabled": {"type": "boolean"},
          "source_profiles": {
            "type": "array",
            "items": {
              "type": "object",
              "required": ["source_profile_id", "source_kind", "status", "enabled"],
              "properties": {
                "source_profile_id": {"type": "string", "minLength": 1},
                "source_kind": {"enum": ["excel", "text_or_image", "web_backend", "api", "manual"]},
                "status": {"enum": ["active", "pending", "retired"]},
                "enabled": {"type": "boolean"}
              },
              "additionalProperties": false
            }
          },
          "workflows": {
            "type": "array",
            "items": {
              "type": "object",
              "required": [
                "workflow_id",
                "source_profile_id",
                "route_id",
                "target_platform",
                "target_profile_id",
                "platform_rules_profile_id",
                "product_mapping_scope_id",
                "runtime_enabled"
              ],
              "properties": {
                "workflow_id": {"type": "string", "minLength": 1},
                "source_profile_id": {"type": "string", "minLength": 1},
                "route_id": {"type": "string", "minLength": 1},
                "target_platform": {"type": "string", "minLength": 1},
                "target_profile_id": {"type": "string", "minLength": 1},
                "platform_rules_profile_id": {"type": ["string", "null"]},
                "product_mapping_scope_id": {"type": ["string", "null"]},
                "runtime_enabled": {"type": "boolean"}
              },
              "additionalProperties": false
            }
          },
          "generic_fallback": {
            "type": "object",
            "required": [
              "source_profile_id",
              "route_id",
              "target_platform",
              "target_profile_id",
              "platform_rules_profile_id",
              "product_mapping_scope_id",
              "runtime_enabled"
            ],
            "properties": {
              "source_profile_id": {"const": "generic_company_manual_v1"},
              "route_id": {"const": "generic_company_manual_to_guanyi_v1"},
              "target_platform": {"const": "guanyi"},
              "target_profile_id": {"const": "guanyi_order_import_v1"},
              "platform_rules_profile_id": {"const": "guanyi_generic_company_manual_v1"},
              "product_mapping_scope_id": {"const": "generic_company_manual_v1"},
              "runtime_enabled": {"const": true}
            },
            "additionalProperties": false
          },
          "capabilities": {"type": "object"},
          "source_refs": {"type": "array", "items": {"type": "string", "minLength": 1}, "minItems": 1},
          "last_verified_on": {"type": "string", "format": "date"}
        },
        "allOf": [
          {
            "if": {
              "properties": {"status": {"const": "identity_only"}},
              "required": ["status"]
            },
            "then": {
              "required": ["legal_name", "abbreviation"],
              "properties": {
                "enabled": {"const": false},
                "source_profiles": {"maxItems": 0},
                "workflows": {"maxItems": 0}
              }
            }
          },
          {
            "if": {
              "properties": {"status": {"const": "fallback_enabled"}},
              "required": ["status"]
            },
            "then": {
              "required": ["legal_name", "abbreviation", "generic_fallback"],
              "properties": {
                "enabled": {"const": true},
                "source_profiles": {"maxItems": 0},
                "workflows": {"maxItems": 0}
              }
            }
          },
          {
            "if": {
              "properties": {"status": {"const": "active"}},
              "required": ["status"]
            },
            "then": {
              "properties": {
                "source_profiles": {"minItems": 1}
              }
            }
          }
        ],
        "additionalProperties": false
      }
    }
  },
  "additionalProperties": false
}
