{
  "schema_version": "1.0",
  "registry_id": "shangyu_company_registry_v1",
  "status": "active",
  "design_note": "公司库保存稳定身份、法定名称、公司简称、固定工作流引用和通用兜底绑定；固定模板优先，fallback_enabled公司仅在没有固定工作流时使用共享兜底。简称只在规则显式引用时作为单号前缀。",
  "companies": [
    {
      "company_id": "tiantian",
      "display_name": "恬田",
      "aliases": [
        "恬田代发仓",
        "代发仓-恬田",
        "上海恬田食品有限公司",
        "TT"
      ],
      "status": "active",
      "enabled": true,
      "source_profiles": [
        {
          "source_profile_id": "tiantian_warehouse_v2",
          "source_kind": "excel",
          "status": "active",
          "enabled": true
        }
      ],
      "workflows": [
        {
          "workflow_id": "tiantian_guanyi_custom_import_v2",
          "source_profile_id": "tiantian_warehouse_v2",
          "route_id": "tiantian_warehouse_to_guanyi_v2",
          "target_platform": "guanyi",
          "target_profile_id": "guanyi_order_import_v1",
          "platform_rules_profile_id": "guanyi_tiantian_warehouse_v2",
          "product_mapping_scope_id": "tiantian_warehouse_v2",
          "runtime_enabled": true
        }
      ],
      "capabilities": {
        "source_recognition": {
          "status": "ready"
        },
        "order_conversion": {
          "status": "ready_for_employee_acceptance",
          "runtime_enabled": true
        },
        "automatic_upload": {
          "status": "not_enabled",
          "runtime_enabled": false,
          "reason": "管易确定提交、自动审核和发货仍保持关闭。"
        }
      },
      "source_refs": [
        "docs/RULE_SOURCE_LEDGER.md",
        "docs/DECISIONS.md",
        "用户确认与真实样本测试：2026-09-30至2026-10-01",
        "各公司对应简称.xlsx（SHA-256: b93bb0291cf45f95dacad0c7629cadee3548f87eaba2781dad739fb235bc9de7）"
      ],
      "last_verified_on": "2026-10-10",
      "legal_name": "上海恬田食品有限公司",
      "abbreviation": "TT"
    },
    {
      "company_id": "sam",
      "display_name": "SAM",
      "aliases": [
        "sam哥的品牌号",
        "SAM群接龙",
        "上海欣略实业有限公司"
      ],
      "status": "active",
      "enabled": true,
      "source_profiles": [
        {
          "source_profile_id": "sam_order_v1",
          "source_kind": "excel",
          "status": "active",
          "enabled": true
        }
      ],
      "workflows": [
        {
          "workflow_id": "sam_guanyi_custom_import_v1",
          "source_profile_id": "sam_order_v1",
          "route_id": "sam_to_guanyi_v1",
          "target_platform": "guanyi",
          "target_profile_id": "guanyi_order_import_v1",
          "platform_rules_profile_id": "guanyi_sam_order_v1",
          "product_mapping_scope_id": "sam_order_v1",
          "runtime_enabled": true
        }
      ],
      "capabilities": {
        "source_recognition": {
          "status": "ready"
        },
        "order_conversion": {
          "status": "ready_for_employee_acceptance",
          "runtime_enabled": true
        },
        "automatic_upload": {
          "status": "not_enabled",
          "runtime_enabled": false,
          "reason": "SAM仍处于转换验收阶段，不进入管易真实上传。"
        }
      },
      "source_refs": [
        "docs/RULE_SOURCE_LEDGER.md",
        "docs/ORDER_AUTOMATION_RULES_V0.1.md",
        "用户确认真实SAM样本：2026-10-01",
        "用户确认SAM组合商品与买家会员规则：2026-10-02",
        "各公司对应简称.xlsx（SHA-256: b93bb0291cf45f95dacad0c7629cadee3548f87eaba2781dad739fb235bc9de7）"
      ],
      "last_verified_on": "2026-10-10",
      "legal_name": "上海欣略实业有限公司",
      "abbreviation": "SAM"
    },
    {
      "company_id": "ndd",
      "display_name": "NDD",
      "aliases": [
        "NDD礼品订单",
        "上海牛多多电子商务有限公司"
      ],
      "status": "active",
      "enabled": true,
      "source_profiles": [
        {
          "source_profile_id": "ndd_order_v1",
          "source_kind": "excel",
          "status": "active",
          "enabled": true
        }
      ],
      "workflows": [
        {
          "workflow_id": "ndd_guanyi_custom_import_v1",
          "source_profile_id": "ndd_order_v1",
          "route_id": "ndd_to_guanyi_v1",
          "target_platform": "guanyi",
          "target_profile_id": "guanyi_order_import_v1",
          "platform_rules_profile_id": "guanyi_ndd_order_v1",
          "product_mapping_scope_id": "ndd_order_v1",
          "runtime_enabled": true
        }
      ],
      "capabilities": {
        "source_recognition": {
          "status": "standard_template_auto_legacy_requires_explicit_hint",
          "reason": "NDD公司最终模板v1.2（Roy版）通过固定示例标记自动识别；旧版后台导出没有稳定公司字段，仍需用户明确NDD。"
        },
        "order_conversion": {
          "status": "ready_for_employee_acceptance",
          "runtime_enabled": true
        },
        "automatic_upload": {
          "status": "not_enabled",
          "runtime_enabled": false,
          "reason": "NDD仍处于生成Excel验收阶段。"
        }
      },
      "source_refs": [
        "尚舆发货流程.pdf p.10",
        "NDD原始样本与人工管易成品：2026-10-05",
        "NDD完整字段标准模板v1.2（Roy最终版）：2026-10-08",
        "docs/RULE_SOURCE_LEDGER.md",
        "各公司对应简称.xlsx（SHA-256: b93bb0291cf45f95dacad0c7629cadee3548f87eaba2781dad739fb235bc9de7）"
      ],
      "last_verified_on": "2026-10-10",
      "legal_name": "上海牛多多电子商务有限公司",
      "abbreviation": "NDD"
    },
    {
      "company_id": "self_operated",
      "display_name": "尚舆自营平台",
      "aliases": [
        "我们自己的",
        "自营天猫",
        "自营京东",
        "淘橘子",
        "淘宝文字单",
        "KQYD企业店",
        "JZDZ",
        "DRJY",
        "橘子定制",
        "达人寄样"
      ],
      "status": "active",
      "enabled": true,
      "source_profiles": [
        {
          "source_profile_id": "self_operated_text_v1",
          "source_kind": "text_or_image",
          "status": "active",
          "enabled": true
        },
        {
          "source_profile_id": "taojuzi_taobao_text_v1",
          "source_kind": "text_or_image",
          "status": "active",
          "enabled": true
        },
        {
          "source_profile_id": "taojuzi_kqyd_text_v1",
          "source_kind": "text_or_image",
          "status": "active",
          "enabled": true
        },
        {
          "source_profile_id": "jzdz_manual_v1",
          "source_kind": "text_or_image",
          "status": "active",
          "enabled": true
        },
        {
          "source_profile_id": "drjy_manual_v1",
          "source_kind": "text_or_image",
          "status": "active",
          "enabled": true
        }
      ],
      "workflows": [
        {
          "workflow_id": "self_operated_text_guanyi_v1",
          "source_profile_id": "self_operated_text_v1",
          "route_id": "self_operated_text_to_guanyi_v1",
          "target_platform": "guanyi",
          "target_profile_id": "guanyi_order_import_v1",
          "platform_rules_profile_id": "guanyi_self_operated_text_v1",
          "product_mapping_scope_id": "self_operated_text_v1",
          "runtime_enabled": true
        },
        {
          "workflow_id": "taojuzi_taobao_text_guanyi_v1",
          "source_profile_id": "taojuzi_taobao_text_v1",
          "route_id": "taojuzi_taobao_text_to_guanyi_v1",
          "target_platform": "guanyi",
          "target_profile_id": "guanyi_order_import_v1",
          "platform_rules_profile_id": "guanyi_taojuzi_taobao_text_v1",
          "product_mapping_scope_id": "taojuzi_taobao_text_v1",
          "runtime_enabled": true
        },
        {
          "workflow_id": "taojuzi_kqyd_text_guanyi_v1",
          "source_profile_id": "taojuzi_kqyd_text_v1",
          "route_id": "taojuzi_kqyd_text_to_guanyi_v1",
          "target_platform": "guanyi",
          "target_profile_id": "guanyi_order_import_v1",
          "platform_rules_profile_id": "guanyi_taojuzi_kqyd_text_v1",
          "product_mapping_scope_id": "taojuzi_kqyd_text_v1",
          "runtime_enabled": true
        },
        {
          "workflow_id": "jzdz_manual_guanyi_v1",
          "source_profile_id": "jzdz_manual_v1",
          "route_id": "jzdz_manual_to_guanyi_v1",
          "target_platform": "guanyi",
          "target_profile_id": "guanyi_order_import_v1",
          "platform_rules_profile_id": "guanyi_jzdz_manual_v1",
          "product_mapping_scope_id": "jzdz_manual_v1",
          "runtime_enabled": true
        },
        {
          "workflow_id": "drjy_manual_guanyi_v1",
          "source_profile_id": "drjy_manual_v1",
          "route_id": "drjy_manual_to_guanyi_v1",
          "target_platform": "guanyi",
          "target_profile_id": "guanyi_order_import_v1",
          "platform_rules_profile_id": "guanyi_drjy_manual_v1",
          "product_mapping_scope_id": "drjy_manual_v1",
          "runtime_enabled": true
        }
      ],
      "capabilities": {
        "source_recognition": {
          "status": "agent_text_intake_requires_user_confirmation"
        },
        "order_conversion": {
          "status": "ready_for_employee_acceptance",
          "runtime_enabled": true
        },
        "automatic_upload": {
          "status": "not_enabled",
          "runtime_enabled": false,
          "reason": "文字单先完成生成Excel验收，自动提交保持关闭。"
        }
      },
      "source_refs": [
        "文字订单截图样本：2026-10-08",
        "用户确认自营天猫/京东店铺、单号和袋商品规则：2026-10-08；根的含义待首次确认",
        "用户确认淘宝与KQYD文字单均进入淘橘子；原分钟序号已于2026-10-17被中央日序号替代：2026-10-09/2026-10-17",
        "docs/TEXT_ORDER_INTAKE_V0.1.md",
        "用户于2026-10-15确认JZDZ、DRJY作为员工可见的独立手工业务来源，底层归属尚舆自营。"
      ],
      "last_verified_on": "2026-10-15"
    },
    {
      "company_id": "rongzhida",
      "display_name": "荣之达",
      "aliases": [
        "RZD",
        "rzd",
        "合肥荣之达智能科技有限公司"
      ],
      "status": "active",
      "enabled": true,
      "source_profiles": [
        {
          "source_profile_id": "rongzhida_text_v1",
          "source_kind": "text_or_image",
          "status": "active",
          "enabled": true
        }
      ],
      "workflows": [
        {
          "workflow_id": "rongzhida_text_guanyi_v1",
          "source_profile_id": "rongzhida_text_v1",